{
  "manufacturer": "Bambu Lab",
  "model": "X1 Carbon",
  "protocol_family": "bambu_mqtt",
  "build_volume": {
    "type": "rectangular",
    "x": 256.0,
    "y": 256.0,
    "z": 256.0
  },
  "bed_shape": "rectangular",
  "nozzle_diameters": [0.2, 0.4, 0.6, 0.8],
  "default_nozzle_diameter": 0.4,
  "min_layer_height": 0.08,
  "max_layer_height": 0.28,
  "max_hotend_temp": 300.0,
  "max_bed_temp": 110.0,
  "has_enclosure": true,
  "supports_mmu": true,
  "firmware_flavor": "bambu",
  "supported_file_types": ["gcode", "3mf"],
  "supports_direct_upload": true,
  "supports_pause_resume": true,
  "supports_cancel": true,
  "supports_job_progress": true,
  "supports_webcam": true,
  "supports_chamber_temp": true,
  "known_quirks": [],
  "unsafe_commands": [],
  "filename_restrictions": null
}
